{
  "schema_version": "ultrajarvis.backlog/v1",
  "program": "ultraJARVIS",
  "generated_at": "2026-08-17T08:10:13.713Z",
  "source_ref": "agent/ultrajarvis-master-prompt-v1",
  "scope_note": "The four-AI initial portfolio is baselined at 311 accepted-weight units. Meta-bootstrap and zero-weight auxiliary candidates are tracked separately. The total lifetime scope of ultraJARVIS remains UNKNOWN.",
  "baselines": [
    {
      "baseline_id": "initial-four-ai-portfolio",
      "title": "Initial portfolios for ChatGPT, Claude, Gemini, and Grok",
      "scope_status": "BASELINED",
      "declared_weight": 311,
      "task_ids": [
        "UJ-INT-001",
        "UJ-INT-002",
        "UJ-INT-003",
        "UJ-INT-004",
        "UJ-INT-005",
        "UJ-INT-006",
        "UJ-INT-007",
        "UJ-INT-008",
        "UJ-RUN-001",
        "UJ-SEC-001",
        "UJ-SKL-001",
        "UJ-MCP-001",
        "UJ-RCV-001",
        "UJ-CLD-001",
        "UJ-REV-001",
        "UJ-REV-002",
        "UJ-CAP-001",
        "UJ-GGL-001",
        "UJ-INF-001",
        "UJ-MEM-001",
        "UJ-KNW-001",
        "UJ-MED-001",
        "UJ-ADK-001",
        "UJ-REV-003",
        "UJ-RED-001",
        "UJ-RSK-001",
        "UJ-OSS-001",
        "UJ-ALT-001",
        "UJ-INJ-001",
        "UJ-MED-RED-001",
        "UJ-LIVE-001",
        "UJ-REV-004"
      ],
      "notes": "81 ChatGPT + 76 Claude + 81 Gemini + 73 Grok."
    },
    {
      "baseline_id": "m0-bootstrap-snapshot",
      "title": "M0 initial state tasks named in master prompt section 38",
      "scope_status": "DRAFT",
      "declared_weight": 94,
      "task_ids": [
        "UJ-META-001",
        "UJ-META-002",
        "UJ-INT-001",
        "UJ-RUN-001",
        "UJ-CAP-001",
        "UJ-GGL-001",
        "UJ-RED-001"
      ],
      "notes": "Requires owner acceptance with PR #1; 26 weight is currently accepted."
    },
    {
      "baseline_id": "meta-bootstrap",
      "title": "Canonical prompt production and publication",
      "scope_status": "DRAFT",
      "declared_weight": 29,
      "task_ids": [
        "UJ-META-001",
        "UJ-META-002"
      ],
      "notes": "Publication remains in REVIEW until owner decision and merge."
    }
  ],
  "tasks": [
    {
      "task_id": "UJ-META-001",
      "title": "Fuse the Claude, Gemini, Grok, and ChatGPT plans into one canonical prompt",
      "epic": "Program bootstrap",
      "milestones": [
        "M0"
      ],
      "owner": "CHATGPT",
      "reviewer": "Christian",
      "status": "DONE",
      "priority": "P0",
      "dependencies": [],
      "inputs": [
        {
          "ref": "docs/ULTRAJARVIS_UNIVERSAL_MASTER_PROMPT.md",
          "version": "1.0",
          "hash": "sha256:a3fcdfc97b48e9b1f37e1a1798b0b5e7231309d03ab4e13683622eaf1fa69a87"
        }
      ],
      "output_contract": "Canonical universal master prompt v1.0",
      "acceptance_criteria": [
        {
          "criterion_id": "AC-01",
          "text": "Canonical prompt contains the merged program contract and four portfolios.",
          "state": "PASSED",
          "proof_refs": [
            "docs/ULTRAJARVIS_UNIVERSAL_MASTER_PROMPT.md"
          ]
        },
        {
          "criterion_id": "AC-02",
          "text": "Prompt structure and declared hash were validated in PR #1.",
          "state": "PASSED",
          "proof_refs": [
            "https://github.com/carnascialichristian-wq/ultraJARVIS/pull/1"
          ]
        }
      ],
      "proof": [
        {
          "ref": "docs/ULTRAJARVIS_UNIVERSAL_MASTER_PROMPT.md",
          "version": "1.0",
          "hash": "sha256:a3fcdfc97b48e9b1f37e1a1798b0b5e7231309d03ab4e13683622eaf1fa69a87"
        },
        {
          "ref": "https://github.com/carnascialichristian-wq/ultraJARVIS/pull/1"
        }
      ],
      "data_class": "C1",
      "side_effect": "INTERNAL_WRITE",
      "approval_gate": "REVIEWED_BRANCH_PR",
      "weight": 21,
      "completed_weight": 21,
      "remaining_weight": 0,
      "confidence": {
        "level": "HIGH",
        "reason": "The artifact and its review PR are directly observable."
      },
      "blocker": null,
      "next_action": "Preserve the prompt hash and route amendments through change control.",
      "updated_at": "2026-08-17T07:36:19.727Z"
    },
    {
      "task_id": "UJ-META-002",
      "title": "Publish and review the canonical prompt in the repository",
      "epic": "Program bootstrap",
      "milestones": [
        "M0"
      ],
      "owner": "Christian",
      "reviewer": "Christian",
      "status": "REVIEW",
      "priority": "P0",
      "dependencies": [
        "UJ-META-001"
      ],
      "inputs": [
        {
          "ref": "docs/ULTRAJARVIS_UNIVERSAL_MASTER_PROMPT.md",
          "version": "1.0",
          "hash": "sha256:a3fcdfc97b48e9b1f37e1a1798b0b5e7231309d03ab4e13683622eaf1fa69a87"
        }
      ],
      "output_contract": "Accepted and merged canonical prompt pull request",
      "acceptance_criteria": [
        {
          "criterion_id": "AC-01",
          "text": "Prompt and launch README exist on a reviewable branch and draft PR.",
          "state": "PASSED",
          "proof_refs": [
            "https://github.com/carnascialichristian-wq/ultraJARVIS/pull/1"
          ]
        },
        {
          "criterion_id": "AC-02",
          "text": "Christian accepts or amends the Constitution, infrastructure default, and M0 baseline.",
          "state": "PENDING",
          "proof_refs": []
        },
        {
          "criterion_id": "AC-03",
          "text": "PR #1 is merged and the default branch contains the canonical artifacts.",
          "state": "PENDING",
          "proof_refs": []
        }
      ],
      "proof": [
        {
          "ref": "https://github.com/carnascialichristian-wq/ultraJARVIS/pull/1"
        },
        {
          "ref": "agent/ultrajarvis-master-prompt-v1",
          "version": "b8a7697ca69722fe1947e24350752907ee58cfd2"
        }
      ],
      "data_class": "C1",
      "side_effect": "INTERNAL_WRITE",
      "approval_gate": "REVIEWED_BRANCH_PR",
      "weight": 8,
      "completed_weight": 5,
      "remaining_weight": 3,
      "confidence": {
        "level": "HIGH",
        "reason": "Branch and PR are observed; owner acceptance and merge are still absent."
      },
      "blocker": {
        "kind": "AWAITING_HUMAN",
        "cause": "PR #1 is draft and requires owner decisions on Constitution, strict zero-card mode, and M0 baseline.",
        "resolver": "Christian"
      },
      "next_action": "Review the named decisions in PR #1; amend or approve before merge.",
      "updated_at": "2026-08-17T07:36:19.727Z"
    },
    {
      "task_id": "UJ-INT-001",
      "title": "Create the canonical Program OS",
      "epic": "Program integration",
      "milestones": [
        "M0"
      ],
      "owner": "CHATGPT",
      "reviewer": "GROK",
      "status": "REVIEW",
      "priority": "P0",
      "dependencies": [
        "UJ-META-001"
      ],
      "inputs": [
        {
          "ref": "docs/ULTRAJARVIS_UNIVERSAL_MASTER_PROMPT.md",
          "version": "1.0",
          "hash": "sha256:a3fcdfc97b48e9b1f37e1a1798b0b5e7231309d03ab4e13683622eaf1fa69a87"
        }
      ],
      "output_contract": "Program state, backlog, status, workstreams, handoff, governance, reconciliation, and resume artifacts",
      "acceptance_criteria": [
        {
          "criterion_id": "AC-01",
          "text": "All twelve deliverable groups in master prompt §39.1 exist as repository artifacts.",
          "state": "PENDING",
          "proof_refs": [
            "docs/program/PROJECT_STATE.md",
            "schemas/backlog.schema.json",
            "docs/program/BACKLOG.json",
            "docs/program/STATUS.md",
            "docs/program/WORKSTREAMS.md",
            "docs/program/HANDOFFS.md",
            "schemas/handoff-packet.schema.json",
            "docs/adrs/ADR_TEMPLATE.md",
            "docs/adrs/README.md",
            "docs/program/CONFLICTS_AND_ASSUMPTIONS.md",
            "docs/program/PROGRESS.md",
            "docs/program/GOVERNANCE.md",
            "docs/program/SPECIALIST_INPUTS.md",
            "docs/program/RECONCILIATION.md",
            "docs/program/RESUME_POINT.md",
            "scripts/validate-program-os.mjs"
          ]
        },
        {
          "criterion_id": "AC-02",
          "text": "Standalone validation confirms unique task IDs, dependency integrity, weight arithmetic, portfolio total 311, and baseline totals.",
          "state": "PENDING",
          "proof_refs": [
            "scripts/validate-program-os.mjs"
          ]
        },
        {
          "criterion_id": "AC-03",
          "text": "Grok independently reviews progress resistance and Program OS consistency.",
          "state": "PENDING",
          "proof_refs": []
        }
      ],
      "proof": [
        {
          "ref": "docs/program/PROJECT_STATE.md"
        },
        {
          "ref": "schemas/backlog.schema.json"
        },
        {
          "ref": "docs/program/BACKLOG.json"
        },
        {
          "ref": "docs/program/STATUS.md"
        },
        {
          "ref": "docs/program/WORKSTREAMS.md"
        },
        {
          "ref": "docs/program/HANDOFFS.md"
        },
        {
          "ref": "schemas/handoff-packet.schema.json"
        },
        {
          "ref": "docs/adrs/ADR_TEMPLATE.md"
        },
        {
          "ref": "docs/adrs/README.md"
        },
        {
          "ref": "docs/program/CONFLICTS_AND_ASSUMPTIONS.md"
        },
        {
          "ref": "docs/program/PROGRESS.md"
        },
        {
          "ref": "docs/program/GOVERNANCE.md"
        },
        {
          "ref": "docs/program/SPECIALIST_INPUTS.md"
        },
        {
          "ref": "docs/program/RECONCILIATION.md"
        },
        {
          "ref": "docs/program/RESUME_POINT.md"
        },
        {
          "ref": "scripts/validate-program-os.mjs"
        }
      ],